MultiTarget conformance to AccessTokenAuthorizable,2020-01-02,Merged,1979,34,1,swift ,3
Improved access token plugin,2019-12-09,Merged,1969,53,44,swift ,4
"Add `mapString`, `mapDecodable` funtion take multiple key paths parameter",2019-11-25,Closed,1965,248,8,,6
Update URL+Moya.swift,2019-11-25,Merged,1957,3,2,,1
Fixing Data race conditions caught by TSAN,2019-12-09,Merged,1952,45,39,md xcscheme swift ,10
Update URL+Moya Change,2019-12-09,Closed,1950,3,2,,1
Alamofire 5.0.0-rc.3,2019-10-27,Merged,1944,9,6,resolved md podspec swift ,5
Update Readme for version 14.0.0-beta.4,2019-10-05,Merged,1934,14,14,,0
Remove Combine.,2019-10-05,Merged,1933,13,625,swift podspec pbxproj ,5
Add Combine folder to source_files in Podspec,2019-10-03,Merged,1930,1,1,,1
Skip building testing libraries for SPM users.,2019-09-27,Merged,1923,115,50,resolved swift yml ,4
Fix stubbed requests that didn't persist plugin changes.,2019-09-20,Merged,1921,63,14,swift ,5
Weak-link Combine.,2019-09-20,Merged,1920,27,0,pbxproj sh ,2
NetworkLoggerPlugin curl fixes.,2019-09-12,Merged,1916,93,18,swift ,6
Link Combine weakly,2019-09-20,Closed,1915,26,0,xcconfig pbxproj ,2
Alamofire 5.0.0-rc.2,2019-09-09,Merged,1912,9,8,resolved md podspec swift ,5
Remove OHHTTPStubs to fix SPM support for Xcode,2019-09-06,Merged,1910,2,11,swift ,2
Update to Alamofire 5.0.0-rc.1,2019-09-06,Merged,1909,11,10,resolved md podspec swift ,8
Update to Alamofire 5.0.0-rc.1,2019-09-06,Closed,1908,"1,535",593,Cartfile private resolved md swift podspec ,10
NetworkLoggerPlugin formatter,2019-09-06,Merged,1906,140,87,md ,3
Combine support!,2019-09-06,Merged,1904,624,55,md swift pbxproj Rakefile ,6
Update Readme_CN.md,2019-08-20,Merged,1897,1,1,,0
[WIP] SPM testing! (+ some other minor updates),2019-09-02,Merged,1896,169,74,pbxproj swift ,22
Adding more customization to NetworkLoggerPlugin.,2019-09-02,Merged,1894,201,143,swift ,5
Use CACHE_VERSION environment variable for CircleCI caches,2019-08-03,Merged,1891,26,26,lock ,2
Update Testing.md,2019-08-02,Merged,1890,1,1,,0
Fix a typo,2019-07-31,Merged,1886,1,1,,0
"Add ""bug?"" to the list of exemptLabels for Stale bot",2019-07-09,Merged,1881,1,0,,1
Fixed NetworkLoggerPlugin behavior with errors.,2019-08-05,Merged,1880,41,15,swift ,2
Add missing session headers to Request/NetworkLoggerPlugin.,2019-08-01,Merged,1878,100,31,pbxproj swift ,8
Danger swift,2019-07-11,Merged,1873,149,208,Dangerfile swift Gemfile ,5
Add target type in output of network logger plugin,2019-06-04,Merged,1866,23,17,swift ,3
"Update Releasing.md with few additional steps to ""After release"" paragraph.",2019-05-30,Merged,1862,7,2,,0
Drop Result,2019-05-15,Merged,1858,9,42,resolved md podspec pbxproj swift ,16
Updated Chinese docs per MoyaBot recommendation.,2019-05-09,Merged,1856,2,2,,0
Updated DispatchQueue.global with latest Swift syntax.,2019-05-09,Merged,1855,2,2,,0
[OHHTTPStubs] Update to version 8,2019-05-02,Merged,1850,2,2,resolved ,2
ReactiveSwift 6.0,2019-05-02,Merged,1849,7,6,resolved md podspec swift ,5
Update develop to master,2019-05-01,Merged,1848,44,40,md lock podspec swift ,4
Updating development with master,2019-05-01,Closed,1847,44,40,md lock podspec swift ,4
RXSwift 5,2019-05-02,Merged,1846,23,23,resolved podspec swift ,7
Use compatible version requirements in installation guides.,2019-05-01,Merged,1845,8,8,,0
Remove alamoRequest.cancel() from stubbing closure,2019-05-01,Merged,1841,4,8,md swift ,2
[WIP] Drop Result dependency,2019-05-14,Closed,1839,12,24,resolved podspec swift ,13
Update Gemfile.lock,2019-04-10,Merged,1838,22,19,,1
Update Readme for Moya 13,2019-04-10,Merged,1837,10,10,,0
[Release] Moya 13,2019-04-10,Merged,1835,432,150,Cartfile private resolved md swift podspec pbxproj Rakefile ,11
[README] Document support & installation via Accio,2019-04-09,Merged,1834,5,0,,0
Add bundle install command as a requirement for release,2019-03-31,Merged,1831,1,0,,0
Prepare docs for Moya 13,2019-03-31,Merged,1830,19,12,,0
Swift 5!,2019-03-31,Merged,1829,37,44,private resolved md swift podspec pbxproj Rakefile ,10
Remove deprecations hanging since Moya 11,2019-03-31,Merged,1828,3,10,swift ,1
Fix Xcode 10.2 warnings,2019-03-30,Merged,1826,26,23,pbxproj swift ,10
Development,2019-03-28,Closed,1824,347,69,resolved md podspec swift ,12
Bump ReactiveSwift to 5.0 and Result to 4.1,2019-03-19,Merged,1817,30,25,resolved podspec swift ,6
Fix progress object with invalid Content-Length headers.,2019-03-10,Merged,1815,98,6,swift ,2
Fix proselint on Dangerfile,2019-03-05,Merged,1812,2,2,,1
Alamofire 5!,2019-08-01,Merged,1810,284,144,Cartfile resolved md podspec pbxproj swift ,7
"Use new Alamofire append(_ fileURL, …) function with optional parameters",2019-12-09,Merged,1805,1,9,,1
Update Moya version in Readme.md from 11 to 12,2019-02-13,Merged,1804,1,1,,0
Replace #if os() with #if canImport,2019-02-13,Merged,1803,23,26,,5
Make a restriction for CocoaPods version ~> 1.6,2019-02-12,Merged,1800,2,2,Gemfile ,2
Observable.mapImage() returns non-optional image,2019-02-11,Merged,1799,3,2,swift ,2
[Docs] Update AccessTokenPlugin init w/ autoclosure now,2019-02-12,Merged,1798,2,2,,0
Added discardable result attribute to status code filters,2019-02-12,Closed,1790,7,0,swift ,1
Single mapImage shouldn’t be optional,2019-02-11,Merged,1789,2,2,,2
Update AlamofireValidation.md,2019-01-11,Merged,1787,4,4,,0
Conform MoyaError to CustomNSError in addition to LocalizedError,2019-03-01,Merged,1783,189,8,swift ,2
Remove internal access control.,2018-11-28,Closed,1777,15,15,,4
Fix pod install error for RxMoya and ReactiveMoya subspecs due to watchOS version,2018-11-19,Merged,1769,9,12,podspec pbxproj ,2
Adding Pod lib lint to CI,2018-11-28,Merged,1767,3,0,,1
Fix watchos deployment target in podspec,2018-11-19,Merged,1766,2,1,,1
Add missing projects to Chinese Community Projects,2018-11-28,Merged,1764,4,0,,0
Add SwiftHub to CommunityProjects,2018-11-16,Merged,1763,2,0,,0
Update Readme_CN.md,2018-11-16,Merged,1762,1,1,,0
Bump RxMoya's watchOS deployment target to 3.0,2018-11-18,Merged,1758,4,2,podspec pbxproj ,2
Development v12 cleanup,2018-11-06,Merged,1756,1,1,,1
[Release] Moya 12.0,2018-11-18,Merged,1753,286,161,swift-version Cartfile resolved md lock podspec ,6
Enhancement/enable danger prose plugin,2018-12-05,Merged,1748,23,0,Dangerfile Gemfile ,3
Fix unit test build failed,2018-10-24,Merged,1746,7,7,swift ,2
Fix for issue #1259,2018-10-20,Merged,1745,16,1,,0
Update Readme_CN.md,2018-10-18,Merged,1742,92,89,,0
Fix warnings generated by Xcode 10,2018-10-18,Merged,1740,39,37,resolved md pbxproj xcscheme swift ,9
updating to xcode 10 and swift 4.2 warnings,2018-10-14,Closed,1730,13,13,swift ,2
update,2018-09-27,Closed,1729,415,0,,4
fixed a typo,2018-09-27,Merged,1728,1,1,,0
Updates RxSwift to version 4.3.1,2018-10-18,Closed,1724,1,1,,1
Updates RxSwift and RxCocoa to version 4.2.0,2018-09-13,Closed,1723,2,2,md ,1
Update Providers.md,2018-08-15,Merged,1714,1,1,,0
Sync master with development,2018-09-11,Closed,1712,203,48,Gemfile lock pbxproj Rakefile md ,5
Add Moya 11 to 12 migration guide,2018-08-07,Merged,1710,21,1,,0
✨Danger package manifest warning (#1672),2018-08-03,Merged,1708,44,17,,1
Fix a header doc to remove the image type specification,2018-07-28,Merged,1703,1,1,,1
Adding Danger xcode_sumary,2018-06-23,Merged,1680,66,17,Gemfile lock pbxproj Rakefile ,5
Adds a danger rule to remind us to include resolved files when updating,2018-05-23,Merged,1670,8,0,,1
Bump dependencies for Result and ReactiveSwift,2018-07-24,Merged,1668,28,24,resolved md podspec swift ,5
Issue templates,2018-06-05,Closed,1660,52,0,,0
Adds note to Vision.md,2018-05-02,Merged,1659,1,0,,0
Update project Swift version && CocoaPods integration,2018-06-08,Merged,1656,87,40,swift-version podspec pbxproj swift ,12
Update gem resolve file,2018-04-21,Merged,1646,20,20,,1
Allow customization of formatting in NetworkLoggerPlugin,2019-09-17,Closed,1644,139,68,swift ,4
Workaround to fix long Carthage build times,2019-04-05,Closed,1642,27,1,,0
Fix .md links for https://moya.github.io,2018-04-16,Merged,1640,20,20,,0
✨add Papr to CommunityProjects,2018-04-09,Merged,1634,1,0,,0
Update Response.md for new filter signature,2018-04-08,Merged,1632,2,2,,0
Sync master and development branches,2018-04-08,Merged,1631,77,100,md swift podspec pbxproj ,9
Added Testing Documentation,2018-04-10,Merged,1630,70,1,,0
No Brown M&M's,2018-04-05,Merged,1628,4,0,,0
Making range filter generic to any range type.,2018-04-06,Merged,1624,8,40,md swift ,5
refactor Rx/ReactiveMoya syntax,2018-04-07,Merged,1623,32,64,,3
Fix swiftlint errors and warnings,2018-03-30,Closed,1621,34,28,,9
Run SwiftLint only on debug builds,2018-04-01,Merged,1619,38,33,md swift pbxproj ,9
Xcode 9.3 test run & dependencies update.,2018-04-03,Merged,1617,35,9,plist ,3
Remove SwiftLint build phases,2018-04-01,Closed,1615,21,110,pbxproj swift ,5
Update AccessTokenPlugin,2018-04-10,Merged,1611,74,26,swift ,2
Sync development branch with master,2018-03-14,Merged,1606,614,277,resolved ,3
Adding convenience Range filter.,2018-03-27,Merged,1605,214,10,swift ,7
Migrates to Circle CI 2.0,2018-03-05,Merged,1602,135,73,lock Rakefile swift ,5
Perform validation on stubbed responses,2018-02-25,Merged,1593,99,10,swift ,2
Fix Alamofire validation not being performed on uploadMultipart,2018-02-24,Merged,1591,91,12,swift ,4
Fixed grammar and contractions in Contributing.md,2018-02-17,Merged,1589,14,14,,0
AlamofireValidation Chinese document update,2018-02-15,Merged,1587,14,5,,0
Moya 10 to 11 migration guide Chinese document.,2018-02-15,Merged,1586,19,0,,0
mapOptional<D: Decodable>( ... ) for Observable and Signal,2018-02-13,Closed,1581,43,16,,2
mapOptional<D: Decodable>( ... ) for Observable and Signal,2018-02-10,Closed,1580,277,180,,1
Updated Dangerfile,2018-02-10,Merged,1579,7,0,,1
Add discussion label to exemptLabels for StaleBot,2018-02-09,Merged,1577,1,0,,1
"Update ""Sample projects"" refs in documentation.",2018-02-09,Merged,1573,6,8,,0
Update Cartfile.lock,2018-02-10,Merged,1572,1,1,,1
Update Moya version in Readme.,2018-02-08,Merged,1571,10,10,,0
Add MoyaProvider migration in Moya 11 guide,2018-02-08,Merged,1570,3,0,,0
[Release] Moya 11.0,2018-02-08,Merged,1568,541,144,resolved md swift podspec pbxproj ,12
Fixes changelog style #1395 🚀,2018-02-09,Merged,1566,211,145,,0
Allow URLEncoding.httpBody as bodyEncoding in Task,2018-01-26,Merged,1557,22,4,swift ,2
Add Danger rule to help track English and Chinese docs,2018-01-25,Merged,1553,7,0,,1
Fix small grammatical error,2018-01-24,Merged,1552,1,1,,0
Fix broken link in MultiTarget,2018-02-08,Closed,1551,5,5,,0
Fix wrong reference to target instead of endpoint #1546,2018-01-26,Merged,1550,95,13,pbxproj swift ,5
Fixes #1459 - Include current version in Cocoapods Installation doc,2018-01-16,Merged,1544,6,6,,0
[Release] Moya 11.0.0-beta.1,2018-01-10,Closed,1540,89,22,podspec swift ,15
[WIP] *Do not merge* testing new DangerFile config,2018-04-10,Closed,1537,4,4,swift ,2
"[WIP] Improve DangerFile to warn for podspec, Cartifle or SPM changes",2018-01-08,Closed,1535,31,6,,1
Bump RxSwift to 4.1,2018-01-07,Merged,1532,3,3,,2
Update Package.Resolved for ReactiveSwift 3.0.0,2018-01-07,Merged,1531,2,2,,1
remove endpoint generics,2018-01-27,Merged,1529,51,44,swift ,6
Add Moya 10 to 11 migration guide,2018-01-07,Merged,1527,13,0,,0
Development,2018-01-05,Closed,1525,464,90,resolved md swift podspec pbxproj ,16
"Change copyright to ""Copyright (c) 2014-present Artsy, Ash Furrow""",2018-01-03,Merged,1523,1,1,,0
Add custom header / query parameter auth to AccessTokenPlugin,2018-03-26,Closed,1521,172,82,swift ,2
Progress on issue #1395,2017-12-18,Closed,1509,1,0,,1
Feature/fails on empty data for decodable,2017-12-29,Merged,1508,252,13,swift yml ,9
Update MultiTarget.md,2017-12-14,Merged,1506,1,1,,0
Replace TargetType validate: Bool with validationType: ValidationType,2017-12-28,Merged,1505,106,29,swift pbxproj ,16
Change class-only protocol from class to AnyObject,2017-12-18,Merged,1500,3,3,swift ,1
Increase in source documentation coverage,2018-01-05,Merged,1498,79,12,,15
Add ability to specify JSONEncoder while using requestJSONEncodable task.,2017-12-07,Closed,1495,5,5,,0
Bugfix changelog,2017-12-03,Merged,1489,4,3,,0
Replace develop -> development in contributing docs.,2017-11-28,Merged,1483,5,5,,0
Fix -> Fixed in Changelog,2017-11-23,Merged,1479,2,2,,0
raised ReactiveSwift version dependency 2.0 -> 3.0,2017-11-21,Closed,1476,1,1,,1
Swift does not like single quotes,2017-11-21,Merged,1475,2,2,,0
Fix linter violations,2017-11-18,Closed,1473,18,10,resolved podspec swift ,6
Bump ReactiveSwift to 3.0,2017-11-29,Merged,1470,9,7,resolved md podspec swift ,4
New example: Composing provider,2017-11-21,Merged,1465,65,0,,0
Develop,2017-11-10,Closed,1457,"1,330",402,yml swift-version Cartfile resolved Dangerfile podspec pbxproj ,7
Replaced the target's validate property by an enum,2017-12-12,Closed,1454,158,30,swift pbxproj ,7
fixed missed semicolon in code example,2017-11-09,Merged,1452,2,2,,0
Add Moya's branch guidelines,2017-11-09,Merged,1449,33,14,,0
Add a thank you to the pull request template,2017-11-06,Merged,1445,2,0,,0
Set macOS deployment target to 10.10 to follow pospec,2017-11-09,Merged,1444,9,8,pbxproj ,1
Add Task.requestCustomJSONEncodable,2017-11-29,Merged,1443,84,7,swift ,7
Add documentation to clarify how carthage deals with submodules,2017-11-09,Merged,1438,2,0,,0
Circle test,2017-11-03,Closed,1434,99,40,Cartfile resolved md lock podspec swift ,12
make changes,2017-10-31,Closed,1432,9,0,,1
update docs_CN with MigrationGuides,2017-10-30,Merged,1425,20,0,,0
Fix code style issue for docs.,2017-10-30,Merged,1421,20,13,,0
Ci ignore trivial pasindu,2017-10-28,Closed,1420,20,8,yml sh ,2
require extension-safe api for RxMoya and ReactiveMoya,2017-11-13,Merged,1417,5,4,pbxproj ,1
require extension-safe api for RxMoya in release mode as well,2017-10-26,Closed,1416,3,3,,1
Fix code style error in docs,2017-10-27,Closed,1412,26,21,,0
Added missing content type for requestJSONEncodable task,2017-10-28,Merged,1410,15,1,swift ,2
Readme copyedits,2017-10-25,Merged,1409,4,4,,0
"Fix base value types(String, Int, Bool) mapping cause crash.",2017-11-13,Merged,1405,461,82,swift ,2
Remove redundant reactive abstractions,2017-10-25,Merged,1399,12,34,,2
Less stringent WIP-checking for Danger,2017-10-24,Merged,1397,1,1,,1
Readme clean up,2017-10-23,Merged,1394,14,17,,0
Add .custom option to AuthorizationType of AccessTokenPlugin,2017-10-25,Closed,1393,90,10,swift ,2
Add Changelog entry for decodable fix from 10.0.0-beta.1,2017-10-21,Merged,1391,2,0,,0
Update README's installation guide to use Moya 10.0.0,2017-10-21,Merged,1390,4,4,,0
Update Rakefile to use iOS 11.0.1 to fix CI,2017-10-21,Merged,1388,1,1,,1
[WIP] Update RxSwift.md,2017-11-03,Merged,1386,5,1,,0
Update RxSwift dependency to 4.0.0,2017-10-20,Merged,1385,6,6,resolved podspec swift ,5
Fix a bug that decodable mapping won't decode nested json array,2017-10-21,Merged,1382,53,2,,4
tighten up our stale rules to 2 weeks #fortnight,2017-10-22,Merged,1378,2,2,,1
Test out danger swift on a mac CI build,2018-04-10,Closed,1377,22,42,Gemfile lock yml ,4
Additional updates to SPM installation,2017-10-13,Merged,1375,3,3,,0
Remove ReactiveCocoa subspec,2017-10-12,Merged,1374,3,4,md ,1
10.0.0 dev,2017-10-12,Closed,1373,844,358,Cartfile resolved md podspec pbxproj swift Rakefile ,9
Fix SPM instructions for Moya 10.0.0-beta.1,2017-10-12,Merged,1370,2,2,,0
Add documentation for Response,2017-10-21,Merged,1367,339,0,,0
update files in  docs_CN and README_CN.md,2017-10-11,Merged,1365,219,185,,0
update chinese docs,2017-10-11,Closed,1360,219,185,,0
Improve changelog readability,2017-10-10,Merged,1359,10,10,,0
Refactored Decodable parsing,2017-10-22,Closed,1358,905,352,Cartfile resolved md podspec pbxproj swift ,7
Add Moya 9.0 -> 10.0 migration guide,2017-10-11,Merged,1356,22,6,,0
Add link to migration guides in README,2017-10-08,Merged,1355,2,0,,0
[Stalebot] Adjust the days.,2017-10-07,Merged,1351,3,3,,1
[Rakefile] Add release date to the Changelog in release script,2017-10-08,Merged,1350,2,1,,1
[Feature] Add Task.requestJSONEncodable,2017-10-08,Merged,1349,123,34,pbxproj swift ,9
Feature: Add JSON encodable task,2017-10-07,Closed,1348,75,4,pbxproj swift ,8
Chore: replace addDisposableTo method from RxSwift,2017-10-07,Merged,1347,4,4,,1
Chore: Add stubbing requests example to Basic Example,2017-10-31,Closed,1346,8,3,,0
ArrayAsRootContainer.md example for Alamofire 4.*,2017-10-06,Closed,1344,54,0,,0
Add custom parameter encoding example.,2017-10-07,Merged,1343,42,0,,0
Enable swiftlint for Examples/ + cleanup rules,2017-10-11,Merged,1341,192,107,swift ,5
[xcodeproj] add a number of recommended compiler flags,2017-10-03,Merged,1340,59,24,xcscheme ,5
[WIP] [CI] Update to CircleCI 2.0,2018-02-05,Closed,1339,508,363,swift-version Cartfile resolved md podspec pbxproj swift Rakefile ,9
Added section in readme to ask anyone for help in improving the docs,2017-10-03,Merged,1337,17,0,,0
[Package managers] Update dependencies.,2017-10-02,Merged,1336,17,17,resolved Demo/Podfile lock podspec swift ,7
Add support for mapping response to Decodable object,2017-10-06,Merged,1335,327,1,swift ,8
[Documentation] Fix Contributing & CoC links in Readme,2017-09-30,Merged,1334,2,2,,0
Add Paw-Moya in CommunityProjects.md,2017-09-29,Merged,1332,2,1,,0
Add MultiTarget sample,2017-10-21,Closed,1328,64,7,swift lock ,4
Update CommunityProjects.md,2017-09-29,Closed,1327,1,2,,0
Add Task case to handle request with Encodable type. #1325,2017-10-07,Closed,1326,81,10,resolved md pbxproj ,7
"[WIP][CI] Add new script to exit on non-trivial changes (docs, markdown, etc)",2017-10-02,Closed,1324,12,1,sh ,2
[Documentation] Add Contributing.md & Code of Conduct.md from contributors repo.,2017-09-29,Merged,1322,52,2,,0
Docs  translated into Chinese,2017-09-29,Merged,1321,"2,026",0,,0
[Removed] RxMoyaProvider and ReactiveSwiftMoyaProvider,2017-09-28,Merged,1320,10,216,pbxproj swift ,5
Add PR template,2017-09-26,Merged,1317,9,1,Dangerfile ,1
Set indentWith and tabWidth in project settings,2017-09-27,Merged,1315,2,0,,1
Added Insights for Instragram App,2017-09-26,Merged,1314,1,0,,0
Stop retaining self in rxReuestWithProgress,2017-10-02,Merged,1311,6,3,swift ,1
Update CommunityProjects.md,2017-09-25,Merged,1310,1,1,,0
Access modifier for Swift 4,2017-09-24,Closed,1308,2,2,,1
Update RxSwift dependency to 4.0.0-beta.0,2017-09-23,Merged,1306,10,10,resolved Demo/Podfile lock podspec ,5
fix(rxRequest method),2017-09-21,Closed,1302,3,3,,1
Fixing potential issue with RxSwift request method,2017-09-29,Closed,1294,7,5,swift ,2
Consolidate Demos into Moya.xcodeproj,2017-10-02,Merged,1292,488,"1,028",pbxproj xcworkspacedata xcscheme Demo/Podfile lock swift plist ,10
Update Readme.md,2017-09-18,Closed,1291,1,0,,0
NetworkActivityPlugin to have target in networkActivityClosure.,2017-09-16,Merged,1290,48,18,swift ,4
Remove Endpoint default arguments.,2017-09-16,Merged,1289,13,11,swift ,4
[CI] Enable tvOS/macOS builds.,2017-09-15,Merged,1287,3,3,,1
Update AccessTokenPlugin to be able to pass token as url parameter,2017-09-14,Closed,1279,33,6,,2
Update RxSwift.md,2017-09-09,Merged,1274,1,1,,0
Fix typo: // to ///,2017-09-07,Merged,1269,1,1,,1
Updates SPM manifest to V4 API,2017-09-23,Merged,1266,88,23,resolved swift md ,3
Updates SPM install instructions to use Moya 9,2017-09-06,Merged,1264,2,2,,0
Added switch statement,2017-09-05,Merged,1262,9,7,,0
[Documentation] Update docs for 9.0.0 release.,2017-09-04,Merged,1256,62,211,,0
[Documentation][Examples] Add MultipartUpload.md,2017-09-04,Merged,1255,58,0,,0
[Gardening] Cleaning the code in core a little bit.,2017-09-04,Merged,1254,75,88,swift ,5
Remove default value from Endpoint for task parameter,2017-09-02,Merged,1252,12,9,lock podspec swift ,4
[WIP] Remove default arguments for Endpoint initializer,2017-09-01,Closed,1249,31,16,lock podspec swift ,6
Propagate parameter encoding error for URLRequest mapping,2017-09-26,Merged,1248,174,73,swift ,5
[Tests] Add unit test about uploading multipart data,2017-09-23,Merged,1243,50,3,,2
[Tests] Added a test for progress callback when doing upload task,2017-08-26,Merged,1242,63,6,swift ,2
[Tests] Add tests for creating urlRequest from updated task structure.,2017-08-26,Merged,1241,220,32,md swift ,4
Version table update,2017-09-18,Merged,1239,9,9,,0
`Progress` into the response when calling progress callback on completion,2017-08-25,Merged,1237,19,1,swift ,2
Added installation step for Carthage in Readme.,2017-08-24,Merged,1236,6,0,,0
Be notified of progress using the callback closure also for data request,2017-08-23,Merged,1234,43,5,swift ,3
Be notified of progress using the callback closure also for data request,2017-08-22,Closed,1232,43,4,,3
Added tests for Single+Response and refactored Shared Test Helpers,2017-08-17,Merged,1229,352,78,pbxproj swift ,4
MISTAKE PR,2017-08-16,Closed,1228,650,438,swift pbxproj Rakefile ,6
[Docs] Update MigrationGuides.md for changes to reactive API,2017-08-16,Merged,1225,6,0,,0
[SPM] Fix warnings when building Moya module.,2017-08-16,Merged,1224,4,1,,3
RxMoya: Create Single directly instead of Observable.create().asSingle(),2017-08-15,Merged,1220,4,5,,1
[Project] Fix Single+Response owner to RxMoya.,2017-08-15,Merged,1218,2,2,,1
Add AuthorizationType with Basic header,2017-08-17,Merged,1215,97,63,swift ,2
[RxSwift] Add operators to Single<Response>,2017-08-13,Merged,1213,61,1,pbxproj swift ,2
[Docs] Update reactive descriptions.,2017-08-13,Merged,1212,53,19,swift ,1
Update ErrorTypes.md to represent response in .underlying case,2017-08-10,Merged,1211,4,4,,0
Correct spelling of behvaior #trivial,2017-08-09,Merged,1204,1,1,,1
Delete the redundant import statement.,2017-08-02,Merged,1197,0,8,,8
Update core to support Swift 4.,2017-08-04,Merged,1193,6,5,Rakefile swift yml ,3
Update docs for reactive changes,2017-08-08,Merged,1192,14,125,,0
Update dependencies,2017-07-25,Merged,1185,21,20,resolved md lock podspec swift ,6
Adds Vision document,2017-07-27,Merged,1183,32,0,,0
[Release] 9.0.0-alpha.1,2017-07-29,Merged,1181,"1,129",884,private resolved md lock swift podspec ,8
Updates documentation for URL(target:) init,2017-07-21,Merged,1180,6,2,,0
[General] Add public URL(target:) initializer.,2017-07-21,Merged,1178,22,13,pbxproj swift ,3
[Documentation] Move threading docs to Threading.md & expand it a bit.,2017-07-20,Merged,1173,31,19,,0
Add BasicAuthPlugin,2017-08-11,Closed,1172,17,0,swift ,2
Fix: Xcode 9 Beta submission bug,2017-07-15,Merged,1169,93,63,,3
"Update stale.yml label to ""stale""",2017-07-11,Merged,1168,1,1,,1
"convert ""if let"" -> ""switch case""",2017-07-07,Merged,1165,4,5,,1
[Stubbing] Add callbackQueue to stubRequest.,2017-07-07,Merged,1164,12,6,,3
[Reactive] Update tests to new API & fix double response problem in ReactiveSwift extension.,2017-07-12,Merged,1163,231,82,pbxproj swift ,2
[General] Availability cleanup.,2017-07-20,Merged,1162,1,54,pbxproj swift ,3
Remove quotes around 'no recent activity' label in stale.yml,2017-07-05,Merged,1161,5,2,,1
Set probot closeComment to false in stale.yml configuration,2017-07-05,Merged,1160,1,4,,1
Removes markdown from stale.yml,2017-07-05,Merged,1159,1,1,,1
Remove emojis from stale.yml configuration,2017-07-03,Merged,1158,2,2,,1
Update stale.yml configuration,2017-07-03,Merged,1157,1,1,,1
Remove string percent encoding in NetworkLoggerPlugin #2,2017-06-30,Merged,1155,26,3,swift ,2
[Feature] Migrate from multiple providers to Reactive implementations (`rx` & `reactive`).,2017-07-06,Merged,1153,699,714,resolved md lock pbxproj xcscheme swift ,12
Remove string percent encoding in NetworkLoggerPlugin,2017-06-30,Closed,1151,0,0,,0
Extract and reuse networkCompletion closure in requestNormal body,2017-06-29,Merged,1149,13,22,,1
[WIP] Support Encodable types natively,2017-06-29,Closed,1148,122,64,,5
Flatten enums & parameters into extended Task type,2017-08-09,Merged,1147,176,331,swift ,9
Update Dangerfile to warn when tests were not updated,2017-06-27,Merged,1146,6,0,,1
Add testing.md,2017-06-25,Merged,1142,12,0,,0
Create Reactive providers via `rx` or `reactive`,2017-06-30,Closed,1140,186,63,md lock pbxproj swift ,10
Adding endpoint parameters to multipart form data,2017-08-12,Closed,1139,18,11,,1
[WIP] Support Encodable types in TargetType,2017-06-28,Closed,1136,52,56,,5
Merge pull request #1 from Moya/master,2017-06-18,Closed,1132,0,0,,0
"Enable ""Allow app extension API only"" flag",2017-06-17,Merged,1127,9,6,pbxproj ,1
[9.0.0] Merge master into 9.0.0-dev,2017-06-17,Merged,1124,904,636,gitignore private resolved md Dangerfile pbxproj swift lock ,10
appendingPathComponent  didn't work well,2017-06-14,Closed,1121,5,2,,1
[Documentation] Fix example on how to send params in URL on POST,2017-06-13,Merged,1120,4,3,,0
Renames occurrences of `queue` to `callbackQueue`,2017-06-12,Merged,1117,66,65,swift ,6
[Docs][Examples][Add Assets downloading setup & a little cleanup],2017-06-05,Merged,1113,94,5,,0
Update readme regarding json fixture files,2017-06-04,Merged,1112,2,2,,0
[StaleBot] Changes number of days in close comment,2017-06-01,Merged,1109,1,1,,1
"Use consistent heading styles, fix indentation + spelling",2017-05-26,Merged,1106,132,175,,0
[Documentation] Update Releasing.md instructions,2017-05-26,Merged,1105,24,7,,0
[Tests] Add separate SwiftLint config & clean up.,2017-05-26,Merged,1103,269,258,swift ,7
[StaleBot] Add first version of stale.yml config.,2017-06-01,Merged,1101,33,0,,1
[Tests] Update MatcherFunc to new Nimble Predicate API.,2017-05-24,Merged,1099,37,36,resolved swift ,4
Update pods in Demo,2017-05-22,Merged,1096,7,7,,1
[RxMoya] Fix double response event in requestWithProgress.,2017-05-22,Merged,1095,183,36,pbxproj swift ,3
[SPM] Git suffix + .gitignore,2017-05-22,Merged,1093,7,6,swift md ,2
[Demo] MultiTarget gardening.,2017-05-20,Merged,1092,3,3,,1
fix typos using misspell,2017-05-20,Merged,1091,20,20,Rakefile swift ,4
