[Docs] withRouter API imported from react-router-dom,2020-01-08,Closed,7097,1,1,,0
Link: Add caveat doc about invariant,2019-12-25,Closed,7078,1,1,,0
explain same component in multiple routes,2019-12-10,Merged,7061,2,0,,0
docs(hashrouter): correction on link example,2019-11-27,Closed,7052,1,1,,0
Fixes link on web quick start docs.,2019-11-21,Closed,7042,1,1,,0
Added a note about how to redirect when using hooks,2019-11-17,Closed,7037,12,0,,0
Add third party animated transitions example,2019-11-16,Closed,7035,184,0,,2
fix(docs): fix broken link to primary components guide,2019-11-18,Merged,7034,1,1,,0
fix: website build (update packages),2019-11-18,Merged,7025,850,125,json ,2
add more detail to useRouteMatch hook documentation,2019-10-24,Merged,7009,10,0,,0
Add URL leading to `useRouteMatch` hook API,2019-12-30,Closed,7007,1,1,,0
Make react-router exports explicit,2019-10-22,Merged,7002,37,14,,2
fix typo in examples: change useRouterMatch to useRouteMatch,2019-10-10,Merged,6988,2,2,,0
release a deprecated react-router-dom,2019-10-09,Closed,6984,"3,136",18,,1
deprecate react-router & react-router-dom and lock on version 4.4.0,2019-10-09,Closed,6983,234,74,,1
Update hooks.md,2019-10-08,Merged,6977,2,2,,0
Update examples and docs to use hooks API,2019-10-08,Merged,6976,"1,045",774,md ,1
Updated examples to fix breaking layout,2019-10-07,Merged,6975,11,2,,0
Update quick-start.md,2019-10-05,Closed,6970,6,2,,0
Centralize jest + babel configs,2019-10-15,Merged,6967,557,883,json babelrc ,14
Use JSX for code block,2019-10-03,Merged,6966,2,2,,0
Fix code example in testing guide,2019-10-03,Merged,6963,1,1,,0
v3: fix React version detection for lifecycle renaming,2019-10-03,Merged,6961,2,2,,2
Fix recursive example,2019-10-02,Merged,6957,1,1,,1
Remove extra space before the ellipsis,2019-10-01,Merged,6956,1,1,,0
Fix documentation for nested routing,2019-10-01,Merged,6952,3,9,,0
pass routing props to children of <Route />,2019-10-01,Closed,6951,35,1,,2
typo: useMatch -> useRouteMatch,2019-09-29,Merged,6948,2,2,js ,1
fix regression to allow for empty-string paths,2019-09-27,Merged,6942,18,1,,2
fix(useParams): fix issue with useParams reading from null object,2019-09-27,Merged,6940,23,1,,2
ADD: status of feature `to function`,2019-09-26,Closed,6933,1,0,,0
add useRouter hook,2019-09-24,Closed,6925,79,17,js ,5
Centralize jest + babel config at repo root,2019-10-15,Merged,6922,469,915,json babelrc ,17
Fix typo in docs for location API,2019-09-14,Merged,6916,1,1,,0
Clarifying documentation <Redirect> exact & strict,2019-09-13,Merged,6915,20,1,,0
"Use forwardRef on Link, NavLink",2019-09-13,Merged,6914,208,102,,4
use getDerivedStateFromProps instead of componentWillReceiveProps,2019-09-11,Merged,6907,19,8,,0
docs: Fix missing comma in docs/api/location.md,2019-09-11,Merged,6904,1,1,,0
remove clever example in testing guide,2019-09-19,Merged,6903,96,101,,0
Fix quick-start guide: nested route doesn't work,2019-09-04,Closed,6895,1,1,,0
docs: fix typo in docs/guides/code-splitting.md,2019-08-28,Merged,6887,1,1,,0
Link - add element shape for innerRef,2019-08-27,Merged,6886,6,2,,1
Make to prop for Links optional,2019-08-22,Closed,6884,13,9,,1
react-router-v3: Add UNSAFE_ prefixes to deprecated lifecycle methods,2019-08-23,Merged,6883,48,18,json lock ,4
Improve documentation readability for matchPath,2019-08-08,Merged,6867,13,11,,0
add script for linting,2019-08-07,Closed,6864,20,0,js ,2
NavLink - pass currentLocation to isActive prop (#6862),2019-09-10,Merged,6863,17,3,,2
Add linting to react router native,2019-08-05,Closed,6859,"1,108",174,,1
add linting to travis build,2019-08-05,Closed,6857,9,0,,1
export default renderToStringStrict,2019-08-04,Merged,6856,1,1,,1
Fix a description mistake in the `Route.md`,2019-08-02,Merged,6853,1,1,,0
Add support `toLocation` to <NavLink /> method isActive,2019-07-27,Closed,6847,45,21,md js ,3
docs: Fix links to reactjs docs,2019-07-25,Merged,6841,6,6,,0
Update Link.md,2019-07-23,Merged,6837,1,1,,0
build: add sourcemaps,2019-07-10,Merged,6823,63,15,js ,6
Update CONTRIBUTING.md,2019-07-03,Merged,6816,4,2,,0
"Add useRouter(), useParams() and useLocation() hooks",2019-07-03,Closed,6812,479,16,md js ,4
matchPath() accepts an array of paths as 2nd argument,2019-06-25,Merged,6809,35,25,md js ,4
docs: update scroll-restoration code example,2019-06-24,Merged,6807,1,1,,0
Support react 16.6 for react-router v3,2019-06-25,Merged,6806,94,19,json lock ,5
Remove basename before pushing internal links,2019-06-18,Merged,6798,16,5,,3
Update Route.md,2019-06-16,Merged,6792,7,5,,0
Added on to the support comment.,2019-06-15,Merged,6788,3,1,,1
add hooks option to scroll restoration docs,2019-06-02,Merged,6762,14,0,,0
Small code change in matchPath.md,2019-05-31,Merged,6761,2,2,,0
esModule: false fix read only TypeError in exports,2019-05-29,Merged,6758,3,3,,3
export explicitly from react-dom to avoid cjs __esModule read only prop,2019-05-28,Closed,6757,24,2,,2
Rename __RouterContext to __FOR_INTERNAL_USE_ONLY__,2019-09-17,Closed,6753,68,145,js ,7
Updated some devDependencies to fix audit warnings,2019-05-11,Merged,6741,"22,345","20,544",,2
Fix build on windows.,2019-05-11,Merged,6740,57,25,json ,7
Replace onClick event listener,2019-05-09,Closed,6736,64,11,,2
remove mini-create-react-context,2019-04-21,Closed,6716,34,62,json ,4
matchPath: Fixed exception thrown if `path` is undefined,2019-04-20,Merged,6715,10,0,,2
change status to statusCode,2019-04-19,Closed,6712,2,2,,0
prevent reload of page if an error occurs in onClick event handler,2019-04-20,Merged,6711,61,19,js ,4
use huskyrc file,2019-04-16,Merged,6706,92,45,json ,3
Update matchPath docs,2019-04-14,Merged,6703,31,0,,0
Add a default value for context in StaticRouter.navigateTo,2019-04-09,Merged,6698,1,1,,1
Switch to mini-create-router-context,2019-04-07,Merged,6692,47,104,js ,5
add noMatchedParams prop to Redirect,2019-04-06,Closed,6691,55,11,md js ,3
call createLocation on 'to' regardless of type,2019-04-06,Merged,6690,36,5,,2
withRouter: Directly use RouterContext instead of Route.,2019-04-03,Merged,6685,36,29,js ,3
Pin create-react-context to 0.2.2,2019-04-01,Merged,6682,7,7,,2
fix(react-router): Allow string and object refs in withRouter,2019-05-15,Merged,6680,5,1,,1
Fix website internal links not prepended with public path,2019-04-09,Merged,6678,37,48,js ,4
fix: set DisplayName correctly for Named Context,2019-03-29,Merged,6677,2,2,,1
Document Redirect sensitive prop.,2019-03-29,Merged,6676,4,0,,0
Fixed maximum update depth exceeded caused by Redirect.,2019-04-02,Merged,6674,36,2,,2
Update Jest and react-router-native dev deps,2019-03-26,Merged,6668,"15,163","8,579",,3
Implemented Match component.,2019-06-12,Closed,6666,508,36,js ,3
Added onKeyPress handler to Link.,2019-03-24,Closed,6664,130,0,,2
Wrote event handling tests for Link.,2019-03-24,Merged,6663,95,2,,1
"Removing ""update blocking"" content",2019-05-15,Merged,6652,110,353,js ,1
Example references deprecated API,2019-03-19,Merged,6646,2,2,,0
Use Lerna file specifiers,2019-04-03,Closed,6644,"27,248","58,077",json ,3
Activating Open Collective,2019-09-17,Closed,6637,38,3,json ,1
Fix undefined Element #6610,2019-03-13,Closed,6624,156,27,js ,9
Don't override path in NavLink component. Fixes #6613,2019-05-16,Merged,6623,99,29,js ,4
Basic support of partial <Route /> paths (with passing tests),2019-06-12,Closed,6618,0,0,,0
Fix typo in comment,2019-03-06,Merged,6615,1,1,,0
"Adds missing ""const"" keyword to Element",2019-03-02,Merged,6609,1,1,,1
Polyfill Element for Node,2019-03-03,Merged,6607,2,0,,1
Fixes offset for sample code,2019-03-01,Merged,6606,1,1,,1
change from ariaCurrent to aria-current,2019-02-25,Merged,6599,1,1,,0
add note about promise in `getComponent`,2019-02-19,Merged,6586,4,1,,0
"Proposal: link recibe a function as ""to"" prop",2019-02-11,Closed,6579,5,1,,1
Refactor `renderRoutes` to use `matchRoutes`,2019-09-17,Closed,6577,27,19,,1
Add support for exact route matching in `matchRoutes`,2019-09-17,Closed,6575,80,20,js ,3
Fixing Acceptable <Route> Prop Type in Docs,2019-02-01,Closed,6572,2,6,,0
Added RefObject as valid Link innerRef,2019-01-31,Merged,6567,45,8,md js ,3
Modify Route.js __DEV__ Route.propTypes path to oneOfType().isRequired,2019-01-18,Closed,6551,1,1,,1
Fix typo in animation snippet,2019-01-18,Merged,6550,1,1,,0
Replace react-loadable with loadable-components,2019-01-10,Merged,6541,12,26,,0
Changes referenced preset to @babel/preset-react,2019-01-09,Merged,6538,3,2,,0
NavLink.propTypes should extend Link.propTypes,2019-01-08,Merged,6518,8,8,js ,2
refactor: change computedMatch to match,2018-12-05,Closed,6503,"9,960","9,960",js ,6
Convert Link to function component,2019-02-22,Closed,6489,175,56,js ,3
Fix withRouter components being considered forwardRef types,2018-11-24,Merged,6487,14,4,json ,3
Implement CodeSandbox for the examples,2019-03-22,Merged,6482,256,213,,5
Make RouterContext treeshakeable,2018-11-25,Merged,6479,18,15,js ,2
"Remove ""hacking"" section from CONTRIBUTING.md",2018-11-14,Merged,6478,13,5,,0
Convert components to functions,2019-02-22,Closed,6474,195,177,js ,7
Update scroll-restoration.md,2018-11-13,Merged,6472,1,1,,0
Update CHANGES.md,2018-11-11,Merged,6470,1,1,,0
Docs improvement,2018-11-11,Merged,6469,1,1,,0
fixed glitch in doc #6426,2018-11-14,Merged,6468,2,1,,1
"Make Link and NavLink components accept ""to"" property as a function #2",2019-05-23,Closed,6467,161,22,js ,8
Make react-router-dom treeshakable,2018-11-08,Merged,6465,143,30,js ,4
upgrade husky package,2018-11-12,Merged,6463,150,15,,2
Add <Link component> prop,2019-06-13,Merged,6462,93,68,js ,3
[docs] Update create-react-app link,2018-11-06,Merged,6457,1,1,,0
Add useFocus() hook to react-router-dom,2019-07-03,Closed,6454,544,15,,0
Add useRouter hook for React 16.7+,2019-03-19,Closed,6453,73,17,json ,6
Native > Support Text as component,2019-09-17,Closed,6451,7,1,,1
Add <Focus> component to react-router-dom,2019-07-03,Closed,6449,594,12,md js ,2
Issue 6426,2018-11-09,Closed,6448,88,46,,1
Update react-is to 16.6,2018-11-21,Merged,6447,5,5,,2
Fix import of react-is,2018-10-31,Closed,6446,1,1,,1
Replace dev expressions,2018-10-31,Merged,6444,184,70,js ,8
Remove unused import (example directory),2018-10-31,Merged,6441,5,11,,5
Document generatePath function,2018-10-30,Merged,6437,29,1,js ,1
Remove unused imports,2018-10-30,Merged,6436,1,10,,1
"Removed the ""Anywhere"" button from Home Page",2018-10-30,Merged,6432,0,3,,1
Simplify the Quick Start examples,2019-09-17,Closed,6431,14,38,,0
Added async render to Route component,2018-10-28,Closed,6429,"14,131","10,402",,0
Upgrade Jest and switch to jest-circus,2018-10-27,Merged,6427,"12,067","11,761",js ,2
Refactor variables naming,2018-10-24,Merged,6421,4,4,,2
Added react-is to validate the proptype for Route's component.,2018-10-26,Merged,6417,72,289,,2
Align properties,2018-10-23,Merged,6416,3,3,,0
Added warnAboutDeprecatedCJSRequire.js in package.json,2018-10-22,Merged,6415,1,0,,1
Improve Initial Docs Experience,2018-10-25,Merged,6410,83,52,js ,2
docs: change example from componentWillReceiveProps to componentDidUpdate,2018-10-22,Merged,6408,3,3,,0
Refactor - Link.js -  {...props} to {...rest},2018-10-21,Merged,6406,4,3,,1
Upgrade babel and add babel runtime,2018-10-20,Merged,6401,"8,392","4,799",babelrc js ,4
Reduce bundle size by making dependencies external,2018-10-17,Merged,6400,74,169,js ,6
Update Redux Notes to add missing HOC info,2018-10-16,Closed,6397,8,0,,0
Build with multi configs and fix esm entry point,2018-10-15,Merged,6395,"25,483","15,807",,1
Added failing test check for Route and forwardRef,2018-10-15,Closed,6384,31,0,,1
Match component created for issue #6362,2019-02-22,Closed,6383,453,1,,3
Update react-router-native Quickstart Guide,2018-10-05,Merged,6377,2,2,,0
Change match.url to match.path for nested routes,2018-10-04,Merged,6372,2,2,,1
Add example to docs for working with url parameters.,2018-10-15,Merged,6370,90,1,json ,4
Update Animated library to latest version (supports React 16) (fixes #6058),2018-10-09,Merged,6369,16,"3,148",,5
Update Babel plugin name,2018-09-30,Merged,6360,7,7,,0
Update blocked-updates.md,2018-09-21,Merged,6345,6,4,,0
Fix typo in Migration guide for v2/v3 -> v4,2018-09-20,Merged,6343,1,1,,0
Deprecated lifecycles,2018-09-25,Closed,6341,629,532,js ,2
[v3] Access <Link>s underlying node via `innerRef`,2018-09-18,Merged,6340,43,4,js ,2
add matchPath to NavLink,2019-09-17,Closed,6336,20,1,js ,1
Fix <Route component /> type,2018-10-25,Closed,6327,38,1,json ,3
Update history example in FAQ,2018-09-07,Closed,6324,4,2,,0
Correct the false `UpdateBlocker` in docs,2018-09-04,Merged,6321,27,26,,0
React-Dom/Link Use React.PureComponent to avoid re-render,2018-08-31,Closed,6316,1,1,,1
Docs - Replace use of deprecated lifecycle methods with the methods r…,2018-09-19,Closed,6313,164,156,,0
Add UNSAFE to near deprecate lifeCycles,2018-08-30,Closed,6311,14,14,,10
Support for relative path routes,2019-02-22,Closed,6307,156,5,,4
"Added support for using ""onBeforeUnload"" to prompt on external nav.",2018-08-25,Closed,6305,26,2,js ,1
Used named imports for react-router in react-router-config,2018-08-23,Merged,6291,2,4,,2
Revert namespaced history import,2018-08-10,Merged,6288,1,1,,1
Reduce number of StrictMode warnings,2018-10-12,Closed,6287,253,15,,18
Default to NOT_FOUND when match.params.id is bogus,2018-08-09,Closed,6284,3,1,,1
[Redirect] don't import entire history module,2018-08-05,Merged,6278,10,4,js ,5
Update readme for Redux users,2018-08-01,Merged,6274,11,12,,0
Removal of React 16.3 unsafe lifecycles,2018-09-25,Closed,6256,16,9,,1
update header with react training content,2018-09-20,Closed,6255,9,1,,1
renderRoutes should render subroutes,2018-07-10,Closed,6246,16,9,,1
renderRoutes render subroutes,2018-07-10,Closed,6245,16,9,,1
Updating docs for NavLink with possible values for aria-current,2018-07-04,Merged,6238,15,0,,0
Simplified SSR preload example,2019-09-17,Closed,6232,208,0,md json js ,6
Basic support of partial <Route /> paths.,2019-04-07,Closed,6223,159,6,,4
Added preFetch example for react-router-config,2018-06-24,Closed,6222,"8,480",0,json ico txt js scss ,13
remove component not used,2018-06-22,Merged,6220,0,2,,1
Added support for render method in react-router-config,2018-06-22,Merged,6217,24,3,,2
wrap text in a Link with a Text element,2018-06-19,Merged,6214,1,1,,0
Update Link.md,2018-06-19,Closed,6213,2,1,,0
"Run tests against source, CJS, and UMD builds",2018-10-31,Merged,6209,118,7,json ,10
Updated migrating doc from v2/v3 to v4,2018-06-08,Merged,6198,21,1,,0
Declare warning as a dependency instead of devDep,2018-06-06,Closed,6186,"1,726","1,727",,0
"test(core): add failing test to generatePath, see #6171",2018-05-25,Merged,6172,13,1,,2
fix #6168,2018-05-23,Merged,6169,9,9,,0
Adjusted `Route`'s PropTypes to accept a regular expression,2018-10-15,Closed,6165,66,46,js ,2
Enabling url params support in PrivateRoute (Documentation Auth),2018-05-19,Closed,6162,13,17,,1
Add `updateOnLocationChange` (alternative update-blocker breaker),2018-11-29,Closed,6159,"2,662","14,448",json ,3
"Link should work with target=""_self""",2018-10-15,Merged,6138,1,1,,1
Update Link.md,2018-05-06,Merged,6133,2,2,,0
Update README.md,2018-05-03,Merged,6127,3,3,,0
"Fix for Issue #6109 - aria-current has incorrect value ""true""",2018-05-08,Merged,6118,5,5,,2
Change `path-to-regexp` references to ^1.7.0,2018-04-29,Merged,6117,7,7,,0
Embiggen the large breakpoint,2018-04-24,Merged,6107,1,1,,1
Introducing new <Link /> prop - `allowModifiedKeys`,2018-04-24,Closed,6106,400,"9,661",,2
Add sideEffects: false to react-router-dom package.json,2018-04-11,Merged,6082,5,0,,5
sick sentance,2018-04-06,Closed,6069,1,1,,0
Update CONTRIBUTING.md,2018-04-03,Merged,6061,41,2,,0
Fix typo,2018-03-21,Merged,6030,1,1,,0
Typo: wrong const name in docs,2018-03-20,Closed,6026,1,1,,0
Routes with 'children' prop are still rendered inside a Switch,2018-03-18,Closed,6022,24,22,,1
Fix history api changes in react-router-redux,2018-03-26,Merged,6014,59,30,,7
Update match.md,2018-03-06,Merged,6003,1,1,,0
update: translate packages/react-router-redux/README.md &  packages/react-router-redux/README-en.md,2018-03-02,Closed,5993,"1,227","9,077",LICENSE md ,2
update: packages/react-router-dom/docs/guides/quick-start.md to Chinese,2018-03-02,Closed,5992,901,"9,018",LICENSE md ,2
react-router-redux adds assertHistory,2018-03-02,Closed,5991,38,0,js ,3
update: translate api/Switch.md && guides/redux.md into Chinese,2018-03-02,Closed,5990,794,"8,916",LICENSE md ,2
Working example for react-router-redux 5,2018-03-01,Closed,5986,92,0,,1
update: translate packages/react-router/docs/api/Redirect.md && packages/react-router/docs/guides/philosophy.md into Chinese,2018-03-01,Closed,5985,497,79,LICENSE md json js sh enc ,8
Add the ability to pass in an existing React element,2018-03-01,Closed,5984,25,1,,2
Correction for <Redirect /> Web documentation,2018-02-27,Closed,5976,1,1,,0
Note on accessing location.state in Redirect docs,2018-03-04,Merged,5966,2,0,,0
Reimplement tests from #5142,2018-02-22,Merged,5965,43,0,,1
Fix pathless route's match when parent is null,2018-02-22,Merged,5964,128,22,js ,7
withRouter now uses children so that Component is always rendered,2018-02-22,Closed,5963,15,1,,2
Basic support for in-url args,2018-02-19,Closed,5956,230,26,json ,5
Don't hard-code version in ISSUE_TEMPLATE,2018-02-18,Merged,5952,2,1,,0
Fix documentation for Route's sensitive attribute,2018-02-13,Merged,5942,2,1,,0
Prompt doc: add example message returns true,2018-02-12,Merged,5940,1,1,,0
StaticRouter: retain location.state [WiP],2018-03-30,Closed,5935,3,2,,1
Stripped the query strings from pathname before matching against path,2018-02-09,Closed,5934,34,1,,2
stripped the query strings from pathname before matching against path,2018-02-09,Closed,5933,34,1,,2
[Proposal | WiP] Redirect: add addContext prop,2018-02-09,Closed,5930,8,2,,1
Update animation.md,2018-02-06,Merged,5926,1,1,,0
nested Route with relative path support,2018-02-06,Closed,5925,8,4,,2
fix confused names of presentational and container components in react-router-redux examples,2018-02-05,Closed,5922,15,15,,2
"Revert ""Fix non-functional links to routers""",2018-01-29,Merged,5913,2,2,,0
Fix non-functional links to routers,2018-01-29,Merged,5911,2,2,,0
Use new Context API in React 16.3,2018-09-20,Merged,5908,"12,858",986,js ,6
"fix: Route propTypes, path like array of strings",2018-01-27,Closed,5905,1,1,,1
componentDidMount does not take prevProps as an argument,2018-01-27,Merged,5903,1,1,,0
Enable flag in Switch children,2018-01-26,Closed,5902,246,65,js ,4
Allow to pass render prop in config,2018-03-30,Closed,5894,52,42,js ,1
Add precondition function & onPreconditionFailed callback on route co…,2018-01-24,Closed,5893,53,3,,2
Support fragments in <Switch />,2018-03-30,Closed,5892,154,16,,2
add support for an array of paths in <Route> and matchPath,2018-10-15,Merged,5889,146,23,js ,4
pretty-quick v1.2.2,2018-01-18,Merged,5884,4,4,,2
Update `req.url` to be `req.path`,2018-01-16,Merged,5880,1,1,,0
Install the package by yarn.,2018-01-16,Closed,5877,5,0,,0
Run prettier on commit,2018-01-13,Merged,5868,490,205,,0
Warn of possible tooling loss on upgrade,2018-01-10,Merged,5858,2,0,,0
Support for Routing with Access Restriction,2018-01-10,Closed,5857,10,6,,1
Move to PureComponent,2018-01-08,Closed,5849,12,12,,10
Re-add website react-motion dep,2018-01-06,Merged,5845,117,"8,939",,0
Markup JSX in docs,2018-01-05,Merged,5839,118,119,,0
Document v3 <Redirect> query string behavior,2018-01-05,Merged,5837,22,1,,0
Add a very cool use case to the examples,2018-01-04,Closed,5835,138,0,,2
Update Copyright Year,2018-01-03,Merged,5829,1,1,,1
Fix small typo,2018-01-01,Merged,5822,1,1,,0
Example with regex in path,2017-12-27,Merged,5815,14,0,,1
Bring back documentation on Link DOM props,2017-12-18,Merged,5799,5,0,,0
"Add invariant for missing ""to"" property",2018-01-05,Merged,5792,27,3,,2
[FIX]: Allow other middlewares to dispatch routerActions on init,2017-12-14,Merged,5790,31,3,,2
[FIX]: Redirect on mount issue,2017-12-12,Merged,5786,21,6,,2
react-router-redux: update propTypes,2017-12-08,Merged,5777,1,1,,1
Update PrivateRoute in AuthExample to handle a passed in render prop,2017-12-01,Closed,5768,11,11,,1
Allow customising the render of a Switch component,2019-09-17,Closed,5766,10,5,,1
Add Switch location argument to renderRoutes,2017-11-25,Merged,5752,34,3,js ,2
"Fix ""exact match"" test & remove unnecessary check",2017-11-22,Merged,5749,"4,054","7,061",,2
[BUG-FIX]: createMatchSelector isExact,2017-11-22,Merged,5748,19,1,,2
Grammar fix on philosophy page,2017-11-21,Merged,5744,1,1,,0
Listen history in componentWillMount,2017-11-21,Closed,5742,0,4,,1
Add 'exact' & 'strict' props to redirect api doc.,2017-11-17,Merged,5737,8,0,,0
Change `history.location.state` to `object`,2017-11-15,Merged,5732,1,1,,0
Changed prop type of Route component,2017-11-14,Closed,5729,4,1,,1
Update website to Webpack v3,2018-01-05,Merged,5725,"3,515","1,610",,4
Use history.createLocation in <StaticRouter>,2018-03-14,Merged,5722,116,87,,2
Hoist dependencies = smaller react-router-dom UMD,2017-11-13,Merged,5720,"3,290","4,839",js ,2
Fixes bad package-lock file,2017-11-11,Merged,5719,"1,372","2,435",,0
Added server-side rendering example to new React Router Redux package,2018-06-06,Closed,5714,196,2,js ,4
Add 'action' to the react-router-redux LOCATION_CHANGE payload,2017-11-09,Closed,5713,2,2,,1
Remove single child restriction for <Router>,2018-09-21,Closed,5712,7,7,,2
added a much needed comma!,2017-11-09,Merged,5711,1,1,,0
fix small typo,2017-11-07,Merged,5695,1,1,,0
Pass propeties from `Route` to children,2017-11-06,Closed,5693,2,2,,1
Use one import declaration per package,2017-11-06,Closed,5692,3,5,,1
Updated react-transition-group and changed Animation.js example,2017-11-06,Merged,5691,18,16,json ,2
Adds default name attribute to Link and NavLink components to improve accessibility,2017-11-03,Closed,5685,"1,527","4,721",js ,4
fix: wrong path of require,2017-11-02,Merged,5681,1,1,,1
Version 3: Added peerDependency support for React 16.0.0,2017-11-02,Merged,5679,1,1,,1
Fix link to location.md in <Switch> documentation,2017-11-01,Merged,5676,1,1,,0
V3,2017-10-31,Closed,5674,"10,308","1,576",gitignore md js ,14
add namespaces to react-router-redux,2017-10-27,Closed,5664,337,103,,4
Expose generatePath,2017-11-08,Merged,5661,6,0,json ,4
Remove history methods from render of Link,2017-10-24,Closed,5656,16,10,,1
react-router-redux/createMatchSelector: handle null case when router state is not yet initialized,2017-10-24,Merged,5653,8,2,,2
add history action to LOCATION_CHANGE payload,2017-10-23,Closed,5652,2,2,,1
Improvements to react-router-redux examples,2017-11-10,Merged,5647,113,104,,2
Add selectors to files,2017-10-19,Merged,5638,1,0,,1
Update Switch.md,2017-10-18,Closed,5635,2,0,,0
Adding a switch with nested routes,2017-11-07,Closed,5634,70,0,json ,3
[README] remove install instruction for history,2017-10-16,Closed,5624,0,1,,0
enable onUnmatch prop on Router,2017-10-14,Closed,5618,20,8,,3
Added server-side rendering example to new React Router Redux package,2017-11-10,Closed,5614,160,39,,0
Deprecate <Route exact>,2018-03-26,Closed,5612,791,"4,646",,1
Root route remains always active,2017-10-07,Closed,5600,49,0,,1
Escape NavLink path to allow special characters in path.  Fixes #5584,2017-10-06,Merged,5596,40,20,,2
Allow string or object for <NavLink>s className prop,2017-10-05,Closed,5594,1,1,,1
Document Route sensitive option,2017-10-05,Merged,5592,14,0,,0
Use named import of 'history' module to fix #5576.,2017-11-13,Merged,5589,11,7,,7
Wrap examples in create-react-app apps,2019-09-17,Closed,5586,237,31,json html js css ,24
Allow onClick interpret as a bool type,2017-10-03,Closed,5585,4,1,,1
Upgrade hoist-non-react-statics,2017-09-27,Merged,5570,4,4,lock ,2
Updated import statement for mathPath and withRouter in -dom and -native,2017-09-27,Closed,5569,236,4,,0
Update react-router-redux readme to reflect versioning situation.,2017-09-26,Merged,5560,6,1,,0
Adds a note & link to Redux blocked updates,2017-10-03,Merged,5552,18,0,,0
Add action to payload of LOCATION_CHANGE,2017-09-21,Closed,5547,2,2,,1
Store the last history action,2017-09-22,Closed,5545,10,3,,2
react-router-redux useful selectors,2017-09-22,Merged,5543,95,0,,3
fixed brace to curly brace in link wrapper example,2017-09-20,Merged,5541,2,2,,0
Adding documentation to react-router-dom and fixing repo link,2017-09-19,Closed,5537,2,2,json ,1
Proposal: non-blocking updates refactor,2017-09-22,Closed,5534,91,382,,4
Update scroll-restoration.md,2017-09-17,Merged,5532,1,1,,0
there is a typo,2017-09-15,Merged,5530,1,1,,0
Ignore the website in CI,2017-09-28,Merged,5529,29,2,json js ,4
Use yarn to manage dependencies,2017-09-18,Closed,5527,"8,274","36,866",yarnrc json ,3
<Switch> transition example,2017-11-10,Merged,5516,"1,034",326,,1
Update docs and example to use BackButton,2017-09-12,Merged,5513,31,31,js ,2
Add basic working examples to react-router-redux,2017-10-03,Merged,5512,155,0,,2
React 16 support,2017-09-12,Closed,5511,99,61,js json lock ,9
V3 react 16,2017-09-12,Closed,5510,"1,792","1,576",gitignore md js ,12
fix: remove aria-current from navLink when inactive,2017-11-13,Merged,5508,48,4,,2
Use `match.path` for nested routes.,2017-09-11,Merged,5506,2,2,,0
Switch: wrap matched route with `render` or `component` passed to `Switch` if any,2019-09-17,Closed,5505,12,4,,1
Use Jest projects for testing,2018-10-15,Closed,5502,"4,720","3,321",,2
Added component property to NavLink,2017-09-15,Closed,5497,53,2,js ,2
Update history dependencies to match with react-router,2017-09-01,Closed,5490,1,1,,1
"Fix <Link to=""string"">",2017-10-03,Merged,5489,21,3,,2
Updated doc for Route#render,2017-08-30,Closed,5481,1,1,,0
path-to-regexp v2.0.0,2017-11-07,Closed,5470,18,944,,7
Fixing misleading comment,2017-08-26,Merged,5468,1,1,,1
fix various types in glossary,2017-08-26,Merged,5466,11,10,,0
